[
  {"event_id":"evt_macro","timestamp_start":"2026-03-05T12:00:00.000Z","timestamp_end":"2026-03-05T12:01:00.000Z","source_name":"example.com","url":"https://example.com/etf","title":"Bitcoin ETF inflows surge","summary_local":"Bitcoin ETF inflows surge. Fuente detectada: example.com.","topics":["etf_institucional"],"entities":["Bitcoin","ETF","BlackRock"],"source_type":"news_article_candidate","region":"United States","confidence_source":0.9,"relevance_btc":0.9,"retention_mode":"metadata_only","ingested_at":"2026-03-13T00:00:00.000Z","dataset_version":"fixture-narrative"},
  {"event_id":"evt_reg","timestamp_start":"2026-03-06T09:00:00.000Z","timestamp_end":"2026-03-06T09:01:00.000Z","source_name":"example.org","url":"https://example.org/regulation","title":"SEC review drives crypto regulation debate","summary_local":"SEC review drives crypto regulation debate.","topics":["regulacion"],"entities":["SEC","Bitcoin"],"source_type":"news_article_candidate","region":"United States","confidence_source":0.8,"relevance_btc":0.75,"retention_mode":"metadata_only","ingested_at":"2026-03-13T00:00:00.000Z","dataset_version":"fixture-narrative"},
  {"event_id":"evt_noise","timestamp_start":"2026-03-01T09:00:00.000Z","timestamp_end":"2026-03-01T09:01:00.000Z","source_name":"noise.net","url":"https://noise.net/other","title":"Generic macro story","summary_local":"Generic macro story.","topics":["riesgo_global"],"entities":["Macro"],"source_type":"news_article_candidate","region":"United States","confidence_source":0.4,"relevance_btc":0.3,"retention_mode":"metadata_only","ingested_at":"2026-03-13T00:00:00.000Z","dataset_version":"fixture-narrative"}
]
